id,name,code,account_type,chart_template_id/id,reconcile
account_common_canary_47071,"Hacienda Pública, deudora por IGIC régimen transitorio circulante",47071,asset_current,account_chart_template_common_canary,False
account_common_canary_47072,"Hacienda Pública, deudora por IGIC régimen transitorio inversión",47072,asset_current,account_chart_template_common_canary,False
account_common_canary_4727,"Hacienda Pública. IGIC Soportado",4727,asset_current,account_chart_template_common_canary,False
account_common_canary_4777,"Hacienda Pública. IGIC Repercutido",4777,liability_current,account_chart_template_common_canary,False
account_common_canary_6343,"Ajustes negativos en IGIC de circulante",6343,expense,account_chart_template_common_canary,False
account_common_canary_6344,"Ajustes negativos en IGIC de inversión",6344,expense,account_chart_template_common_canary,False
account_common_canary_6393,"Ajustes positivos en IGIC de circulante",6393,expense,account_chart_template_common_canary,False
account_common_canary_6394,"Ajustes positivos en IGIC de inversión",6394,expense,account_chart_template_common_canary,False
