"id","name","name@es","name@ca","code","account_type","reconcile"
"account_full_canary_812","Transferencia de beneficios por coberturas de flujos de efectivo","Transferencia de beneficios por coberturas de flujos de efectivo","Transferencia de beneficios por coberturas de flujos de efectivo",812,"expense","False"
"account_full_canary_813","Transferencia de beneficios por coberturas de inversiones netas en un negocio en el extranjero","Transferencia de beneficios por coberturas de inversiones netas en un negocio en el extranjero","Transferencia de beneficios por coberturas de inversiones netas en un negocio en el extranjero",813,"expense","False"
"account_full_canary_820","Diferencias de conversión negativas","Diferencias de conversión negativas","Diferencias de conversión negativas",820,"expense","False"
"account_full_canary_821","Transferencia de diferencias de conversión positivas","Transferencia de diferencias de conversión positivas","Transferencia de diferencias de conversión positivas",821,"expense","False"
"account_full_canary_830","Impuesto corriente","Impuesto corriente","Impuesto corriente",830,"expense","False"
"account_full_canary_8301","Impuesto diferido","Impuesto diferido","Impuesto diferido",8301,"expense","False"
"account_full_canary_833","Ajustes negativos en la imposición sobre beneficios","Ajustes negativos en la imposición sobre beneficios","Ajustes negativos en la imposición sobre beneficios",833,"expense","False"
"account_full_canary_834","Ingresos fiscales por diferencias permanentes","Ingresos fiscales por diferencias permanentes","Ingresos fiscales por diferencias permanentes",834,"expense","False"
"account_full_canary_835","Ingresos fiscales por deducciones y bonificaciones","Ingresos fiscales por deducciones y bonificaciones","Ingresos fiscales por deducciones y bonificaciones",835,"expense","False"
"account_full_canary_836","Transferencia de diferencias permanentes","Transferencia de diferencias permanentes","Transferencia de diferencias permanentes",836,"expense","False"
"account_full_canary_837","Transferencia de deducciones y bonificaciones","Transferencia de deducciones y bonificaciones","Transferencia de deducciones y bonificaciones",837,"expense","False"
"account_full_canary_838","Ajustes positivos en la imposición sobre beneficios","Ajustes positivos en la imposición sobre beneficios","Ajustes positivos en la imposición sobre beneficios",838,"expense","False"
"account_full_canary_840","Transferencia de subvenciones oficiales de capital","Transferencia de subvenciones oficiales de capital","Transferencia de subvenciones oficiales de capital",840,"expense","False"
"account_full_canary_841","Transferencia de donaciones y legados de capital","Transferencia de donaciones y legados de capital","Transferencia de donaciones y legados de capital",841,"expense","False"
"account_full_canary_842","Transferencia de otras subvenciones, donaciones y legados","Transferencia de otras subvenciones, donaciones y legados","Transferencia de otras subvenciones, donaciones y legados",842,"expense","False"
"account_full_canary_850","Pérdidas actuariales","Pérdidas actuariales","Pérdidas actuariales",850,"expense","False"
"account_full_canary_851","Ajustes negativos en activos por retribuciones a largo plazo de prestación definida","Ajustes negativos en activos por retribuciones a largo plazo de prestación definida","Ajustes negativos en activos por retribuciones a largo plazo de prestación definida",851,"expense","False"
"account_full_canary_860","Pérdidas en activos no corrientes y grupos enajenables de elementos mantenidos para la venta","Pérdidas en activos no corrientes y grupos enajenables de elementos mantenidos para la venta","Pérdidas en activos no corrientes y grupos enajenables de elementos mantenidos para la venta",860,"expense","False"
"account_full_canary_862","Transferencia de beneficios en activos no corrientes y grupos enajenables de elementos mantenidos para la venta","Transferencia de beneficios en activos no corrientes y grupos enajenables de elementos mantenidos para la venta","Transferencia de beneficios en activos no corrientes y grupos enajenables de elementos mantenidos para la venta",862,"expense","False"
"account_full_canary_891","Deterioro de participaciones en el patrimonio, empresas del grupo","Deterioro de participaciones en el patrimonio, empresas del grupo","Deterioro de participaciones en el patrimonio, empresas del grupo",891,"expense_depreciation","False"
"account_full_canary_892","Deterioro de participaciones en el patrimonio, empresas asociadas","Deterioro de participaciones en el patrimonio, empresas asociadas","Deterioro de participaciones en el patrimonio, empresas asociadas",892,"expense_depreciation","False"

"account_full_canary_900","Beneficios en activos financieros disponibles para la venta","Beneficios en activos financieros disponibles para la venta","Beneficios en activos financieros disponibles para la venta",900,"income","False"
"account_full_canary_902","Transferencia de pérdidas en activos financieros disponibles para la venta","Transferencia de pérdidas en activos financieros disponibles para la venta","Transferencia de pérdidas en activos financieros disponibles para la venta",902,"income","False"
"account_full_canary_910","Beneficios por coberturas de flujos de efectivo","Beneficios por coberturas de flujos de efectivo","Beneficios por coberturas de flujos de efectivo",910,"income","False"
"account_full_canary_911","Beneficios por coberturas de inversiones netas en un negocio en el extranjero","Beneficios por coberturas de inversiones netas en un negocio en el extranjero","Beneficios por coberturas de inversiones netas en un negocio en el extranjero",911,"income","False"
"account_full_canary_912","Transferencia de pérdidas por coberturas de flujos de efectivo","Transferencia de pérdidas por coberturas de flujos de efectivo","Transferencia de pérdidas por coberturas de flujos de efectivo",912,"income","False"
"account_full_canary_913","Transferencia de pérdidas por coberturas de inversiones netas en un negocio en el extranjero","Transferencia de pérdidas por coberturas de inversiones netas en un negocio en el extranjero","Transferencia de pérdidas por coberturas de inversiones netas en un negocio en el extranjero",913,"income","False"
"account_full_canary_920","Diferencias de conversión positivas","Diferencias de conversión positivas","Diferencias de conversión positivas",920,"income","False"
"account_full_canary_921","Transferencia de diferencias de conversión negativas","Transferencia de diferencias de conversión negativas","Transferencia de diferencias de conversión negativas",921,"income","False"
"account_full_canary_940","Ingresos de subvenciones oficiales de capital","Ingresos de subvenciones oficiales de capital","Ingresos de subvenciones oficiales de capital",940,"income","False"
"account_full_canary_941","Ingresos de donaciones y legados de capital","Ingresos de donaciones y legados de capital","Ingresos de donaciones y legados de capital",941,"income","False"
"account_full_canary_942","Ingresos de otras subvenciones, donaciones y legados","Ingresos de otras subvenciones, donaciones y legados","Ingresos de otras subvenciones, donaciones y legados",942,"income","False"
"account_full_canary_950","Ganancias actuariales","Ganancias actuariales","Ganancias actuariales",950,"income","False"
"account_full_canary_951","Ajustes positivos en activos por retribuciones a largo plazo de prestación definida","Ajustes positivos en activos por retribuciones a largo plazo de prestación definida","Ajustes positivos en activos por retribuciones a largo plazo de prestación definida",951,"income","False"
"account_full_canary_960","Beneficios en activos no corrientes y grupos enajenables de elementos mantenidos para la venta","Beneficios en activos no corrientes y grupos enajenables de elementos mantenidos para la venta","Beneficios en activos no corrientes y grupos enajenables de elementos mantenidos para la venta",960,"income","False"
"account_full_canary_962","Transferencia de pérdidas en activos no corrientes y grupos enajenables de elementos mantenidos para la venta","Transferencia de pérdidas en activos no corrientes y grupos enajenables de elementos mantenidos para la venta","Transferencia de pérdidas en activos no corrientes y grupos enajenables de elementos mantenidos para la venta",962,"income","False"
"account_full_canary_991","Recuperación de ajustes valorativos negativos previos, empresas del grupo","Recuperación de ajustes valorativos negativos previos, empresas del grupo","Recuperación de ajustes valorativos negativos previos, empresas del grupo",991,"income","False"
"account_full_canary_992","Recuperación de ajustes valorativos negativos previos, empresas asociadas","Recuperación de ajustes valorativos negativos previos, empresas asociadas","Recuperación de ajustes valorativos negativos previos, empresas asociadas",992,"income","False"
"account_full_canary_993","Transferencia por deterioro de ajustes valorativos negativos previos, empresas del grupo","Transferencia por deterioro de ajustes valorativos negativos previos, empresas del grupo","Transferencia por deterioro de ajustes valorativos negativos previos, empresas del grupo",993,"income","False"
"account_full_canary_994","Transferencia por deterioro de ajustes valorativos negativos previos, empresas asociadas","Transferencia por deterioro de ajustes valorativos negativos previos, empresas asociadas","Transferencia por deterioro de ajustes valorativos negativos previos, empresas asociadas",994,"income","False"
